{
  "version": "1.0",
  "status": "READY",
  "observed_request": "用户中心不太方便，稍微优化一下。",
  "goal": "Reduce the interaction cost of editing common profile details.",
  "decomposition": {
    "problem": "Common profile edits require excessive navigation.",
    "cause_hypothesis": "The profile information architecture hides common actions.",
    "requested_action": "Optimize the user center."
  },
  "hypotheses": [
    {
      "id": "H1",
      "interpretation": "The primary problem is the number of steps required for common edits.",
      "probability": 0.92,
      "evidence_for": ["Avatar editing requires three navigation levels."],
      "evidence_against": []
    },
    {
      "id": "H2",
      "interpretation": "The primary problem is visual styling.",
      "probability": 0.08,
      "evidence_for": [],
      "evidence_against": ["Available feedback mentions task difficulty, not appearance."]
    }
  ],
  "evidence": [
    "Avatar editing requires three navigation levels.",
    "Feedback repeatedly mentions difficulty changing profile data."
  ],
  "constraints": ["Do not change the account-security flow."],
  "non_goals": ["Visual rebranding."],
  "assumptions": ["Convenience primarily refers to navigation cost."],
  "conflicts": [],
  "success_criteria": [
    "Avatar and nickname editing each require at most two interactions.",
    "The existing account-security flow remains unchanged."
  ],
  "affected_surface": {
    "confirmed": ["ProfilePage", "ProfileRouter", "AvatarEditor"],
    "estimated_file_count": {
      "min": 4,
      "max": 7,
      "basis": "Confirmed UI and router surfaces plus their focused tests."
    },
    "data_migration": "none"
  },
  "decision_factors": {
    "impact_divergence": "low",
    "reversibility": "easy",
    "risk": "low",
    "evidence_conflict": false
  },
  "execution_gate": "Proceed with a bounded navigation change and preserve the stated assumptions.",
  "clarifying_question": null,
  "verification_plan": [
    "Test interaction counts for avatar and nickname edits.",
    "Run existing account-security regression tests.",
    "Compare the delivered workflow with the original complaint after implementation."
  ]
}
